{"$id":"https://zambo.dev/aer-1/schema.json","$schema":"https://json-schema.org/draft/2020-12/schema","description":"Machine-readable schema for AER-1 (AI Agent Execution Receipt), draft-zambo-aer1-02, Section 3. The core members are required; deployed records MAY carry additional members, and a verifier MUST NOT require them.","properties":{"canonical_bytes":{"description":"Base64 encoding of the exact UTF-8 bytes hashed for the output commitment.","pattern":"^[A-Za-z0-9+/]*={0,2}$","type":"string"},"created_at":{"description":"Timestamp of record creation, RFC 3339.","pattern":"^[0-9]{4}-[0-9]{2}-[0-9]{2}T[0-9]{2}:[0-9]{2}:[0-9]{2}(\\.[0-9]+)?(Z|[+-][0-9]{2}:[0-9]{2})$","type":"string"},"id":{"description":"Stable UUID identifying the receipt.","pattern":"^[0-9a-fA-F]{8}-[0-9a-fA-F]{4}-[0-9a-fA-F]{4}-[0-9a-fA-F]{4}-[0-9a-fA-F]{12}$","type":"string"},"output_hash":{"description":"\"sha256:\" followed by the lowercase hex digest of the decoded canonical_bytes.","pattern":"^sha256:[0-9a-f]{64}$","type":"string"},"provenance_class":{"description":"Exactly one provenance class (Section 5). The first label names the recording system; another implementation substitutes its own system name. The second and third labels are fixed strings.","pattern":"^(EXECUTED BY [A-Z0-9][A-Z0-9 ._-]*|OBSERVED VIA GATEWAY|LOGGED BY AGENT)$","type":"string"},"receipt_schema_version":{"description":"Schema version. \"0.3\" in the reference implementation.","minLength":1,"type":"string"},"tool":{"description":"Names the tool: name, version, and caller scope.","properties":{"name":{"minLength":1,"type":"string"},"scope":{"minLength":1,"type":"string"},"version":{"minLength":1,"type":"string"}},"required":["name","version","scope"],"type":"object"},"verification_status":{"description":"\"verified\" when the stored record passes the Section 6 procedure.","minLength":1,"type":"string"}},"required":["id","receipt_schema_version","created_at","tool","provenance_class","canonical_bytes","output_hash","verification_status"],"title":"AER-1 Execution Receipt","type":"object"}