{"id":"b6c63ac5-f324-4fa7-ad58-c4bf83faa86a","receipt_schema_version":"0.3","created_at":"2026-09-27T09:00:00Z","tool":{"name":"fuzz_tool","version":"1.0.0","scope":"public"},"provenance_class":"EXECUTED BY FUZZ","canonical_bytes":"/w==","output_hash":"sha256:9e2f4f0bdb6bfe12e9f756c913e2b4b277d913e1b31a6e78bd4c3d1ea2c72fc7","verification_status":"verified"}