{"id":"b6c63ac5-f324-4fa7-ad58-c4bf83faa86a","receipt_schema_version":"0.3","created_at":"2026-09-27T09:00:00Z","tool":{"name":"fuzz_tool","version":"1.0.0","scope":"public"},"provenance_class":"EXECUTED BY FUZZ","canonical_bytes":"dW5pY29kZS3wn5iAMzk4","output_hash":"sha256:8485fc234e480703ba1ecff8939e50f385837a8ff77f0a46a0ff4bbd84b5e1a0","verification_status":"verified"}