{"id":"b6c63ac5-f324-4fa7-ad58-c4bf83faa86a","receipt_schema_version":"0.3","created_at":"2026-09-27T09:00:00Z","tool":{"name":"fuzz_tool","version":"1.0.0","scope":"public"},"provenance_class":"EXECUTED BY FUZZ","canonical_bytes":"dW5pY29kZS3wn5iAMTEw","output_hash":"sha256:fd4ddd3f742249624a82e2d263baabd86564eccbd9fc1d5a2e154d2148e979a5","verification_status":"verified"}