{"id":"b6c63ac5-f324-4fa7-ad58-c4bf83faa86a","receipt_schema_version":"0.3","created_at":"2026-09-27T09:00:00Z","tool":{"name":"fuzz_tool","version":"1.0.0","scope":"public"},"provenance_class":"EXECUTED BY FUZZ","canonical_bytes":"dW5pY29kZS3wn5iAMzA=","output_hash":"sha256:a3b2ac1f756557858ae200e050878efb822344d6aefce9f1d019ba1d4b49729a","verification_status":"verified"}