{"id":"b6c63ac5-f324-4fa7-ad58-c4bf83faa86a","receipt_schema_version":"0.3","created_at":"2026-09-27T09:00:00Z","tool":{"name":"fuzz_tool","version":"1.0.0","scope":"public"},"provenance_class":"EXECUTED BY FUZZ","canonical_bytes":"dW5pY29kZS3wn5iANTkw","output_hash":"sha256:046c757c0f97683e75e4c584d1041f038b38f5643d5f54b0f52f9a43a1be35d3","verification_status":"verified"}