{"id":"b6c63ac5-f324-4fa7-ad58-c4bf83faa86a","receipt_schema_version":"0.3","created_at":"2026-09-27T09:00:00Z","tool":{"name":"fuzz_tool","version":"1.0.0","scope":"public"},"provenance_class":"EXECUTED BY FUZZ","canonical_bytes":"dW5pY29kZS3wn5iAMTQ=","output_hash":"sha256:dd816081a57b1fd284fb4167fb0b40c252860bf1b3da66686fc047b37c721942","verification_status":"verified"}