{"id":"b6c63ac5-f324-4fa7-ad58-c4bf83faa86a","receipt_schema_version":"0.3","created_at":"2026-09-27T09:00:00Z","tool":{"name":"fuzz_tool","version":"1.0.0","scope":"public"},"provenance_class":"EXECUTED BY FUZZ","canonical_bytes":"dW5pY29kZS3wn5iAODQ2","output_hash":"sha256:7e247eb593ec7dfc3714e8a5211194dd55957767fca1c9d0a502d23967a20fb7","verification_status":"verified"}