{"id":"b6c63ac5-f324-4fa7-ad58-c4bf83faa86a","receipt_schema_version":"0.3","created_at":"2026-09-27T09:00:00Z","tool":{"name":"fuzz_tool","version":"1.0.0","scope":"public"},"provenance_class":"EXECUTED BY FUZZ","canonical_bytes":"dW5pY29kZS3wn5iAODYy","output_hash":"sha256:856b3f9e004d052577dcb548985a7cb9f2730f6cefce52c716a4ecf80cfa445b","verification_status":"verified"}