{"id":"b6c63ac5-f324-4fa7-ad58-c4bf83faa86a","receipt_schema_version":"0.3","created_at":"2026-09-27T09:00:00Z","tool":{"name":"live_price","version":"4.0.0","scope":"public"},"provenance_class":"EXECUTED BY CI","canonical_bytes":"eyJpbnB1dHMiOnsicGFpciI6IkJUQy9VU0QifSwib3V0cHV0cyI6eyJwcmljZV91c2QiOjk3NDEyLjU1fX0=","output_hash":"sha256:0000000000000000000000000000000000000000000000000000000000000000","verification_status":"verified"}
