{"id":"b6c63ac5-f324-4fa7-ad58-c4bf83faa86a","receipt_schema_version":"0.3","created_at":"2026-09-27T09:00:00Z","tool":{"name":"fuzz_tool","version":"1.0.0","scope":"public"},"provenance_class":"EXECUTED BY FUZZ","canonical_bytes":"dW5pY29kZS3wn5iAODMw","output_hash":"sha256:bde5d277f40a44a9f8f2d344a35bd006942b3ee4cf3193af5a37d6b83d5737e5","verification_status":"verified"}