{"id":"b6c63ac5-f324-4fa7-ad58-c4bf83faa86a","receipt_schema_version":"0.3","created_at":"2026-09-27T09:00:00Z","tool":{"name":"fuzz_tool","version":"1.0.0","scope":"public"},"provenance_class":"EXECUTED BY FUZZ","canonical_bytes":"dW5pY29kZS3wn5iAMjcw","output_hash":"sha256:f9ec734e4799c60a47755c28de81ba31c896dbda04ea657d0a15b58c9b1502e7","verification_status":"verified"}