{
  "id": "a1b2c3d4-1111-4a2b-8c3d-9e8f0a1b2c3d",
  "receipt_schema_version": "0.3",
  "created_at": "2026-09-28T14:30:00.000Z",
  "tool": {
    "name": "live_price",
    "version": "4.0.0",
    "scope": "public"
  },
  "provenance_class": "EXECUTED BY ZAMBO",
  "canonical_bytes": "eyJ0b29sIjoibGl2ZV9wcmljZSIsImlucHV0cyI6eyJwYWlyIjoiQlRDL1VTRCJ9LCJvdXRwdXRzIjp7InByaWNlX3VzZCI6OTc0MTIuNTV9LCJtcyI6MTA4fQ==",
  "output_hash": "sha256:c2258bdf9c34813a70166bc0e2d79b167f22f51a0adb67e218b5c868b911dca7",
  "verification_status": "verified"
}
