{"id":"b6c63ac5-f324-4fa7-ad58-c4bf83faa86a","receipt_schema_version":"0.3","created_at":"2026-09-27T09:00:00Z","tool":{"name":"fuzz_tool","version":"1.0.0","scope":"public"},"provenance_class":"EXECUTED BY FUZZ","canonical_bytes":"dW5pY29kZS3wn5iANTI2","output_hash":"sha256:f307f048fdce3de15df1628c81541d3bfcd23f8ce1f6453eb73c0f1a9b5f0913","verification_status":"verified"}