{"id":"b6c63ac5-f324-4fa7-ad58-c4bf83faa86a","receipt_schema_version":"0.3","created_at":"2026-09-27T09:00:00Z","tool":{"name":"fuzz_tool","version":"1.0.0","scope":"public"},"provenance_class":"EXECUTED BY FUZZ","canonical_bytes":"dW5pY29kZS3wn5iAMzgy","output_hash":"sha256:234dc26d56650a7756943d02ac69f6fd2126d5047a3ad3a773fd5e2daa04cfec","verification_status":"verified"}