{"id":"b6c63ac5-f324-4fa7-ad58-c4bf83faa86a","receipt_schema_version":"0.3","created_at":"2026-09-27T09:00:00Z","tool":{"name":"fuzz_tool","version":"1.0.0","scope":"public"},"provenance_class":"EXECUTED BY FUZZ","canonical_bytes":"dW5pY29kZS3wn5iANjU0","output_hash":"sha256:c29f9a83a79d8e68dcb8d3f7b6a28f2565ee99abc685dd733d7b7940c45cd1f7","verification_status":"verified"}