{"id":"b6c63ac5-f324-4fa7-ad58-c4bf83faa86a","receipt_schema_version":"0.3","created_at":"2026-09-27T09:00:00Z","tool":{"name":"fuzz_tool","version":"1.0.0","scope":"public"},"provenance_class":"EXECUTED BY FUZZ","canonical_bytes":"dW5pY29kZS3wn5iAOTkw","output_hash":"sha256:beb0cc4d1bf9115da53acca6e89b8f5877af790790ac7d524526ef3e24d49857","verification_status":"verified"}