{"id":"b6c63ac5-f324-4fa7-ad58-c4bf83faa86a","receipt_schema_version":"0.3","created_at":"2026-09-27T09:00:00Z","tool":{"name":"fuzz_tool","version":"1.0.0","scope":"public"},"provenance_class":"EXECUTED BY FUZZ","canonical_bytes":"dW5pY29kZS3wn5iANTQy","output_hash":"sha256:7ae3f5c3d866a37562c8d069172de05e313719e4fbe0ee95f1b453a030024d2b","verification_status":"verified"}